### ISSUE TITLE
Can't get Application with request_handler to work

### ISSUE THREAD

**Issue by peshkoff** [mensonen/diameter#10]
I can't get the app to receive messages to work.
Problem in _receive_app_request() in code
```
         if not hasattr(message, "destination_realm"):
             self.logger.warning(
                 f"{conn} realm name present in request "
                 f"{hex(message.header.hop_by_hop_identifier)}")
```
message doesn't have destination_realm in members. It's a encoded in avps. Every incoming message from DRA failed with
```
2024-01-17 14:07:19,008 diameter.node WARNING <PeerConnection(6f5d93471e9a, dra.mncXXX.mccXXX.3gppnetwork.org> realm name present in request 0x37ba11f5
```

**Comment by mensonen** [comment]
Can you provide a sample message dump in some format of the message that fails? A .pcap trace, or some text format dump perhaps?

**Comment by peshkoff** [comment]
Yes. It's a 3GPP Sy (16777302) SLR Init
[slr.zip](https://github.com/mensonen/diameter/files/13963337/slr.zip)

```
Frame 1: 478 bytes on wire (3824 bits), 478 bytes captured (3824 bits) on interface eth1, id 0
Ethernet II, Src: EdgecoreNetw_fb:c7:3e (e4:9d:73:fb:c7:3e), Dst: fa:16:3e:db:52:ab (fa:16:3e:db:52:ab)
Internet Protocol Version 4, Src: 10.220.3.55, Dst: 10.220.3.41
Transmission Control Protocol, Src Port: 3868, Dst Port: 42583, Seq: 533627491, Ack: 1353385429, Len: 412
Diameter Protocol
    Version: 0x01
    Length: 412
    Flags: 0xc0, Request, Proxyable
    Command Code: Spending-Limit (8388635)
    ApplicationId: 3GPP Sy (16777302)
    Hop-by-Hop Identifier: 0xfe9ff96d
    End-to-End Identifier: 0x0027063c
    AVP: Session-Id(263) l=97 f=-M- val=pccm04.s2.nw.data.pcrf.mnc999.mcc999.3gppnetwork.org;999990000000001;Sy;63840915732556452
    AVP: Auth-Application-Id(258) l=12 f=-M- val=3GPP Sy (16777302)
    AVP: Origin-Host(264) l=60 f=-M- val=pccm04.s2.nw.data.pcrf.mnc999.mcc999.3gppnetwork.org
    AVP: Origin-Realm(296) l=50 f=-M- val=nw.data.pcrf.mnc999.mcc999.3gppnetwork.org
    AVP: Destination-Realm(283) l=44 f=-M- val=dra.nw.mnc999.mcc999.3gppnetwork.org
    AVP: Origin-State-Id(278) l=12 f=-M- val=1704873784
    AVP: SL-Request-Type(2904) l=16 f=VM- vnd=TGPP val=INITIAL_REQUEST (0)
    AVP: Subscription-Id(443) l=44 f=-M-
    AVP: Subscription-Id(443) l=40 f=-M-
    AVP: Framed-IP-Address(8) l=12 f=-M- val=164.107.113.18
```

**Comment by peshkoff** [comment]
Another problem: add_peer always adding peer with "_default" app. It will not match 16777302 from incoming message also in  _receive_app_request

**Comment by mensonen** [comment]
The base problem here is that the SLR/SLA (as well as SNR/SNA) command messages were not defined at all.

The diameter stack _can_ parse every message, however it will only convert _known messages_ into python classes, where you can access AVP values via instance attributes.

The application part relies currently only on those python classes with AVPs as instance attributes. In your case it was looking for `destination_realm`, but as the command code was unknown, the parsed message had no instance attributes at all. You _could_ have retrieved it manually using the `diameter.message.Message.find_avps` search method, but the Application stack does not do that.

As a temporary "workaround" I have written python equivalents for Spending-Limit and Spending-Status-Notification command messages , based on 3GPP TS 29.219 version 11.2.0 Release 11. I ran your pcap message on my testbed and it could now both parse your message and route it correctly to an application.

I have plans for making the Application part more generic, but it's still work in progress.

The commit b6470e4 should fix your issue, but I'm not quite ready to release it yet. I have attached a dev build here, in case you've been using the version installed from pip and can't build a copy yourself.

[python_diameter-0.6.2.dev11+gb6470e4.zip](https://github.com/mensonen/diameter/files/13963981/python_diameter-0.6.2.dev11%2Bgb6470e4.zip)

**Comment by peshkoff** [comment]
Yes, messages now parsing correctly! But problem with app is still remain,. 
I mean "add_peer always adding peer with "_default" app. It will not match 16777302 from incoming message also in _receive_app_request"

`no application ID 16777302 present to receive request 0x25d703ab `

**Comment by mensonen** [comment]
It works for me, if I create the application with the 3GPP SY (16777302) application ID:

```python
from diameter.message.constants import *
from diameter.node import Node
from diameter.node.application import ThreadingApplication

class Server(ThreadingApplication):
    def handle_request(self, message: Message) -> Message | None:
        answer = self.generate_answer(message, E_RESULT_CODE_DIAMETER_SUCCESS)
        return answer

node = Node("...")
peer_cfg = node.add_peer("aaa://...", "realm name")
server = Server(application_id=APP_3GPP_SY, is_auth_application=True)
node.add_application(server, [peer_cfg])
```

The message routing inside `Node` looks at two things in each request: the destination realm AVP and the application ID header value. It only routes it to the configured app(s) if both values match.

Also while testing I spotted an error in the earlier build, I had used the same command code value for both SLR and SNR. Commit ef0c986 fixes it, attached a dev build.

[python-diameter-0.6.2.dev13.zip](https://github.com/mensonen/diameter/files/13964905/python-diameter-0.6.2.dev13.zip)

**Comment by peshkoff** [comment]
Changed realm on all sides to dra.nw.mnc999.mcc999.3gppnetwork.org ... But now I have another error when receiving slr ...
```

Exception in thread Thread-5 (_wait_for_recv_msg):
Traceback (most recent call last):
  File "/opt/python/3.12.1/lib/python3.12/threading.py", line 1073, in _bootstrap_inner
    self.run()
  File "/opt/python/3.12.1/lib/python3.12/threading.py", line 1010, in run
    self._target(*self._args, **self._kwargs)
  File "/opt/python/3.12.1/lib/python3.12/site-packages/diameter/node/application.py", line 323, in _wait_for_recv_msg
    process_message.start()
  File "/opt/python/3.12.1/lib/python3.12/threading.py", line 992, in start
    _start_new_thread(self._bootstrap, ())
RuntimeError: can't create new thread at interpreter shutdown
```
...

**Comment by mensonen** [comment]
I have a fix coming up for the multiple realms issue. The diameter node was originally planned to be just a single-realm serving peer, which is why the application routing within the node only takes the realm the node itself was configured with in account. The routing is otherwise multi-realm capable, just the initial route selection ignores all other configured realms.

I need to run a few more tests, but should be able to push the fix out soon.

Can you open a separate issue for the interpreter shutdown problem? It's (obviously) caused by the interpreter shutting down as a new message is coming in, but it should in general be just silent about it and not raise any exceptions.

**Comment by mensonen** [comment]
Ok, after the changes in 9e8e1cc, this works for me in the following configuration:

```python
node = Node("server.realm.net", "realm.net",
            ip_addresses=["127.0.0.1", "127.0.0.2"],
            tcp_port=6090,
            sctp_port=6090,
            vendor_ids=[VENDOR_ETSI, VENDOR_TGPP, VENDOR_TGPP2])

peer_cfg_1 = node.add_peer(
    "aaa://test2.dra.nw.mnc999.mcc999.3gppnetwork.org:6092", 
    "dra.nw.mnc999.mcc999.3gppnetwork.org")
peer_cfg_2 = node.add_peer(
    "aaa://test3.nw.data.pcrf.mnc999.mcc999.3gppnetwork.org:6093", 
    "nw.data.pcrf.mnc999.mcc999.3gppnetwork.org")

server = Server(application_id=APP_3GPP_SY, is_auth_application=True)
node.add_application(server, [peer_cfg_1, peer_cfg_2])
```

With these changes, you can add the one application with multiple peers from different realms and the Node will route them appropriately. The CER/CEA between the node and its peers still uses the realm configured for the node as a whole.

Messages coming with "dra.nw.mnc999.mcc999.3gppnetwork.org" or "nw.data.pcrf.mnc999.mcc999.3gppnetwork.org" now both route to the same application. If you require them to go to different application instances, then you can just call `add_application` once for each peer, instead of what I've done here.

[python_diameter-0.6.2.dev14.zip](https://github.com/mensonen/diameter/files/13965772/python_diameter-0.6.2.dev14.zip)
